{
  "$id": "knowledge-engine/m26-pa-2-live-authorization-v1",
  "$schema": "https://json-schema.org/draft/2020-12/schema",
  "additionalProperties": false,
  "properties": {
    "acceptance_requires_independent_reconciliation": {"const": true},
    "authorized": {"const": true},
    "denied_authority": {
      "additionalProperties": false,
      "properties": {
        "answer_generation": {"const": false},
        "live_provider_calls": {"const": false},
        "production_pointer_mutation": {"const": false},
        "public_shadow_canary_traffic": {"const": false},
        "qdrant_writes": {"const": false},
        "r2_writes": {"const": false},
        "secret_persistence": {"const": false},
        "source_foundation_release_mutation": {"const": false},
        "stage_acceptance": {"const": false}
      },
      "required": ["answer_generation","live_provider_calls","production_pointer_mutation","public_shadow_canary_traffic","qdrant_writes","r2_writes","source_foundation_release_mutation","secret_persistence","stage_acceptance"],
      "type": "object"
    },
    "execution": {
      "additionalProperties": false,
      "properties": {
        "environment": {"const": "m23-r3-diagnostic"},
        "evidence_mode": {"const": "live_read_only"},
        "query_id": {"const": "m26-pa-2-production-binding-v1"},
        "run_attempt": {"const": 1},
        "trigger_marker": {"const": "[m26.pa2-live-authorized-attempt-5]"},
        "workflow_head_is_authorization_merge": {"const": true},
        "workflow_name": {"const": "M26.PA.2 Exact Live Read-Only Evidence"}
      },
      "required": ["workflow_name","environment","run_attempt","query_id","evidence_mode","trigger_marker","workflow_head_is_authorization_merge"],
      "type": "object"
    },
    "future_exact_run": {
      "additionalProperties": false,
      "properties": {
        "environment": {"const": "m23-r3-diagnostic"},
        "github_run_attempt_expected": {"const": 1},
        "logical_attempt": {"const": 5},
        "new_authorization_and_main_push_required": {"const": true},
        "rerun_of_attempt_4_forbidden": {"const": true},
        "same_read_surface_as_attempt_1": {"const": true},
        "trigger_marker": {"const": "[m26.pa2-live-authorized-attempt-5]"},
        "workflow_name": {"const": "M26.PA.2 Exact Live Read-Only Evidence"}
      },
      "required": ["workflow_name","environment","logical_attempt","github_run_attempt_expected","same_read_surface_as_attempt_1","new_authorization_and_main_push_required","rerun_of_attempt_4_forbidden","trigger_marker"],
      "type": "object"
    },
    "implementation": {
      "additionalProperties": false,
      "properties": {
        "head_sha": {"const": "11db7672f0a24c4531ac0203ca89e2c4d0a6e975"},
        "issue_number": {"const": 1186},
        "merge_sha": {"const": "ecad7b2bfb2e6d472bf0ed76d2e0adc818124dd9"},
        "pull_request_number": {"const": 1187},
        "required_ancestor": {"const": true}
      },
      "required": ["issue_number","pull_request_number","head_sha","merge_sha","required_ancestor"],
      "type": "object"
    },
    "logical_attempt": {"const": 5},
    "owner_decision": {
      "additionalProperties": false,
      "properties": {
        "decided_by": {"const": "Daniel Huang"},
        "instruction_date": {"const": "2026-07-27"},
        "instruction_text": {"const": "這個我叫它 QDRANT_API_KEY_READ 已經給你了"},
        "scope": {"const": "exact_pa2_read_only_live_evidence_attempt_5"}
      },
      "required": ["decided_by","instruction_date","instruction_text","scope"],
      "type": "object"
    },
    "predecessor": {
      "additionalProperties": false,
      "properties": {
        "data_plane_operations": {"const": 1},
        "failed_closed": {"const": true},
        "failure_self_sha256": {"pattern": "^[0-9a-f]{64}$", "type": "string"},
        "failure_stage": {"const": "r2-first-read-failed"},
        "logical_attempt": {"const": 4},
        "run_id": {"const": 30258197935},
        "synced_secret_names": {"const": ["R2_ENDPOINT_URL","R2_BUCKET","R2_ACCESS_KEY_ID_READ","R2_SECRET_ACCESS_KEY_READ","QDRANT_URL","QDRANT_READ_ONLY_API_KEY"]}
      },
      "required": ["logical_attempt","run_id","failure_self_sha256","failed_closed","data_plane_operations","failure_stage","synced_secret_names"],
      "type": "object"
    },
    "read_surface": {
      "additionalProperties": false,
      "properties": {
        "qdrant_collection": {"const": "m25_blog_m25blog_5250f8422f4f_f5f01d82c7a1_fe499db2e043_fe499db2e043"},
        "qdrant_expected_point_count": {"const": 4197},
        "qdrant_operations": {"const": ["count","scroll"]},
        "qdrant_page_size": {"const": 256},
        "qdrant_sample_size": {"const": 5},
        "r2_keys": {"const": ["channels/production.json","releases/m25blog-5250f8422f4f-f5f01d82c7a1-fe499db2e043/promotion/m25-10-production-manifest.json"]},
        "r2_operations": {"const": ["get"]},
        "raw_source_body_reads": {"const": false},
        "vectors": {"const": false}
      },
      "required": ["r2_operations","r2_keys","qdrant_operations","qdrant_collection","qdrant_expected_point_count","qdrant_page_size","qdrant_sample_size","vectors","raw_source_body_reads"],
      "type": "object"
    },
    "required_read_only_secret_names": {"const": ["R2_ACCESS_KEY_ID_READ","R2_SECRET_ACCESS_KEY_READ","QDRANT_READ_ONLY_API_KEY"]},
    "schema_version": {"const": "knowledge-engine-m26-pa-2-live-authorization/v1"},
    "secret_names": {"const": ["R2_ENDPOINT_URL","R2_BUCKET","R2_ACCESS_KEY_ID_READ","R2_SECRET_ACCESS_KEY_READ","QDRANT_URL","QDRANT_READ_ONLY_API_KEY"]},
    "self_sha256": {"pattern": "^[0-9a-f]{64}$","type": "string"},
    "stage_id": {"const": "M26.PA.2"}
  },
  "required": ["schema_version","stage_id","logical_attempt","authorized","owner_decision","implementation","predecessor","future_exact_run","execution","read_surface","required_read_only_secret_names","secret_names","denied_authority","acceptance_requires_independent_reconciliation","self_sha256"],
  "title": "M26.PA.2 exact live read-only authorization",
  "type": "object"
}
