{
  "acceptance_requires_independent_reconciliation": true,
  "authorized": true,
  "denied_authority": {
    "answer_generation": false,
    "live_provider_calls": false,
    "production_pointer_mutation": false,
    "public_shadow_canary_traffic": false,
    "qdrant_writes": false,
    "r2_writes": false,
    "secret_persistence": false,
    "source_foundation_release_mutation": false,
    "stage_acceptance": false
  },
  "execution": {
    "environment": "m23-r3-diagnostic",
    "evidence_mode": "live_read_only",
    "query_id": "m26-pa-2-production-binding-v1",
    "run_attempt": 1,
    "trigger_marker": "[m26.pa2-live-authorized-attempt-5]",
    "workflow_head_is_authorization_merge": true,
    "workflow_name": "M26.PA.2 Exact Live Read-Only Evidence"
  },
  "future_exact_run": {
    "environment": "m23-r3-diagnostic",
    "github_run_attempt_expected": 1,
    "logical_attempt": 5,
    "new_authorization_and_main_push_required": true,
    "same_read_surface_as_attempt_1": true,
    "trigger_marker": "[m26.pa2-live-authorized-attempt-5]",
    "workflow_name": "M26.PA.2 Exact Live Read-Only Evidence",
    "rerun_of_attempt_4_forbidden": true
  },
  "implementation": {
    "head_sha": "11db7672f0a24c4531ac0203ca89e2c4d0a6e975",
    "issue_number": 1186,
    "merge_sha": "ecad7b2bfb2e6d472bf0ed76d2e0adc818124dd9",
    "pull_request_number": 1187,
    "required_ancestor": true
  },
  "logical_attempt": 5,
  "owner_decision": {
    "decided_by": "Daniel Huang",
    "instruction_date": "2026-07-27",
    "instruction_text": "這個我叫它 QDRANT_API_KEY_READ 已經給你了",
    "scope": "exact_pa2_read_only_live_evidence_attempt_5"
  },
  "predecessor": {
    "logical_attempt": 4,
    "run_id": 30258197935,
    "failure_self_sha256": "5a633e41110dc857abe944ead2fd22d9b9bd76f30fd0a9e449906301215defd8",
    "failed_closed": true,
    "data_plane_operations": 1,
    "failure_stage": "r2-first-read-failed",
    "synced_secret_names": [
      "R2_ENDPOINT_URL",
      "R2_BUCKET",
      "R2_ACCESS_KEY_ID_READ",
      "R2_SECRET_ACCESS_KEY_READ",
      "QDRANT_URL",
      "QDRANT_READ_ONLY_API_KEY"
    ]
  },
  "read_surface": {
    "qdrant_collection": "m25_blog_m25blog_5250f8422f4f_f5f01d82c7a1_fe499db2e043_fe499db2e043",
    "qdrant_expected_point_count": 4197,
    "qdrant_operations": [
      "count",
      "scroll"
    ],
    "qdrant_page_size": 256,
    "qdrant_sample_size": 5,
    "r2_keys": [
      "channels/production.json",
      "releases/m25blog-5250f8422f4f-f5f01d82c7a1-fe499db2e043/promotion/m25-10-production-manifest.json"
    ],
    "r2_operations": [
      "get"
    ],
    "raw_source_body_reads": false,
    "vectors": false
  },
  "required_read_only_secret_names": [
    "R2_ACCESS_KEY_ID_READ",
    "R2_SECRET_ACCESS_KEY_READ",
    "QDRANT_READ_ONLY_API_KEY"
  ],
  "schema_version": "knowledge-engine-m26-pa-2-live-authorization/v1",
  "secret_names": [
    "R2_ENDPOINT_URL",
    "R2_BUCKET",
    "R2_ACCESS_KEY_ID_READ",
    "R2_SECRET_ACCESS_KEY_READ",
    "QDRANT_URL",
    "QDRANT_READ_ONLY_API_KEY"
  ],
  "self_sha256": "ef5939fd167a236024e4f50c558aaf4e6c14f097b277475d1468bf162311f8a9",
  "stage_id": "M26.PA.2"
}
